{
  "action_source": {
    "id": "learned_visual_policy",
    "provenance": "declared",
    "taxonomy_version": 1
  },
  "adapter": {
    "name": "minestudio_vpt_env",
    "parameters": {
      "camera_order": [
        "pitch",
        "yaw"
      ],
      "hotbar_index_base": 1
    },
    "source_format": "minestudio_env_action_v1",
    "version": 1
  },
  "duration_sec": 0.2,
  "producer": {
    "model_sha256": "aaaaaaaaaaaaaaaaaaaaaaaaaaaaaaaaaaaaaaaaaaaaaaaaaaaaaaaaaaaaaaaa",
    "name": "MineStudio VPT",
    "version": "fixture-v1"
  },
  "schema_version": 1,
  "source_environment": {
    "action_format": "minestudio_env_action_v1",
    "action_tick_rate_hz": 20,
    "minecraft_version": "1.16.5",
    "name": "MineStudio",
    "version": "1.1.4"
  },
  "tick_rate_hz": 20,
  "ticks": [
    {
      "attack": false,
      "camera_delta_degrees": {
        "pitch": 0.0,
        "yaw": 1.25
      },
      "edge_events": [
        {
          "control": "forward",
          "edge": "press"
        },
        {
          "control": "hotbar",
          "edge": "select",
          "slot": 1
        }
      ],
      "held_buttons": [
        "forward"
      ],
      "hotbar": 1,
      "inventory": false,
      "source_tick": 0,
      "tick": 0,
      "use": false
    },
    {
      "attack": true,
      "camera_delta_degrees": {
        "pitch": -0.5,
        "yaw": 2.0
      },
      "edge_events": [
        {
          "control": "jump",
          "edge": "press"
        },
        {
          "control": "attack",
          "edge": "press"
        }
      ],
      "held_buttons": [
        "forward",
        "jump"
      ],
      "hotbar": null,
      "inventory": false,
      "semantic_annotations": [
        "jump_candidate",
        "manual_jump_review"
      ],
      "source_tick": 1,
      "tick": 1,
      "use": false
    },
    {
      "attack": false,
      "camera_delta_degrees": {
        "pitch": 0.5,
        "yaw": -1.0
      },
      "edge_events": [
        {
          "control": "jump",
          "edge": "release"
        },
        {
          "control": "attack",
          "edge": "release"
        },
        {
          "control": "use",
          "edge": "press"
        }
      ],
      "held_buttons": [
        "forward"
      ],
      "hotbar": null,
      "inventory": false,
      "source_tick": 2,
      "tick": 2,
      "use": true
    },
    {
      "attack": false,
      "camera_delta_degrees": {
        "pitch": 0.0,
        "yaw": 0.0
      },
      "edge_events": [
        {
          "control": "forward",
          "edge": "release"
        },
        {
          "control": "use",
          "edge": "release"
        }
      ],
      "held_buttons": [],
      "hotbar": null,
      "inventory": false,
      "source_tick": 3,
      "tick": 3,
      "use": false
    }
  ],
  "trace_sha256": "bf10076faea1b573bf2d50fb5d2e39488134c657975a0d092237d06b03da1a43",
  "world": {
    "seed": 42,
    "snapshot_id": "fixture-world",
    "snapshot_sha256": "bbbbbbbbbbbbbbbbbbbbbbbbbbbbbbbbbbbbbbbbbbbbbbbbbbbbbbbbbbbbbbbb"
  }
}
